09/05/2022 15:44:26,51,23,Male,italian,Bachelors degree,"Systems, Control and Robotics",0,Yes,3,3,,6,,,Higher volume to better understand the robot's orders and acoustic signals after reading a sentence.,2,3,2,1,2,3,3,3,3,2,1,1,1,1,3,3,1,2,3,3,3,the volume should be higher.,"""go with the big blue pyramid, on the side of the big box""",4,4,5,5,3
10/05/2022 10:00:06,52,31,Female,Swedish,Masters degree,Machine Learning,6,No,5,,,,,,It was unclear to me what type of data was measured/recorded from the session,4,4,0,0,4,3,4,4,4,0,0,0,0,0,4,4,4,4,4,0,3,"yes, maybe because i was tired, and sometimes the instructions were ambiguous (deliberately i suppose)","""go with the big blue pyramid, on my right""",5,2,2,1,1
10/05/2022 11:39:35,53,23,Female,Portuguese,Bachelors degree,Energy for Smart Cities,0,Yes,7,10,I had to go.,7,Helping a friend.,I think they can impact a lot on the society. They can help a lot in several tasks and make our lifes easier.,,3,4,2,1,3,3,1,3,4,1,1,1,2,0,3,3,3,4,3,3,4,no.,"""go with the big blue pyramid, on your left""",7,6,7,3,5
10/05/2022 12:14:14,54,25,Male,Indian,Masters degree,Renewable Energy,0,Yes,7,20,when it started getting too repetative,6,help it with some extra inputs,the impact will depend on the design. could be used in museums.,,2,3,1,1,1,1,3,2,3,4,1,4,3,1,4,4,3,2,3,1,3,"yes, it was little confusing sometime.","""go with the big blue pyramid, on your left""",5,5,6,4,5
10/05/2022 16:25:14,55,21,Female,Japanese,High School degree or equivalent (E.g. GED),Computer Science,4,Yes,5,15,Seeing some sentences that I've already read,2,He told me the number to get the prize,They can be our personal helper or friend and make people life easier and more convenient,It was fun to cooperate with a robot and get help from him.,3,2,1,1,1,1,4,3,4,3,3,2,1,1,2,4,2,0,1,1,3,no,"""go with the big blue pyramid, on your left""",5,3,6,3,6
11/05/2022 12:01:34,56,26,Male,Swedish,Bachelors degree,Computer Science,10,No,7,,,,,,,1,3,3,3,2,3,3,4,2,3,3,1,0,3,2,1,1,0,0,3,3,-,"""go with the big blue pyramid, on the side of the big box""",6,5,6,3,2
10/05/2022 14:45:12,57,23,Female,turkish,Bachelors degree,It does not apply.,0,No,6,,,,,,,4,4,0,3,0,2,2,4,4,1,2,2,3,4,4,4,4,4,2,2,2,no,"""go with the big blue pyramid, on the side of the big box""",6,5,2,1,3
10/05/2022 15:27:20,58,23,Female,Hungarian,Bachelors degree,Polymer Technology,2,Yes,5,25,I got bored of the same sentences,1,I want to help the progress of science,"caretaker, information person, cashier etc in jobs that involve a lot of interaction with people and maz get tiring for humans",,4,2,2,3,2,3,3,2,2,1,1,2,1,1,2,3,4,2,1,3,3,I think sometimes the instructions weren!t clear aka could have pointed to two different objects at the same time,"""go with the big blue pyramid, on the side of the big box""",6,4,6,4,5
10/05/2022 17:06:56,59,24,Male,Spanish,Masters degree,"Systems, Control and Robotics",3,Yes,5,30,Time constraints.,6,I signed for the experiment and want to help the researchers have more data to support their conclusions. ,"They can have very strong impacts if they manage to perform well. For example in customer service or giving directions interactive in apps like Google Maps, as well as probably making elder people not feel so alone.",,4,3,1,1,3,2,3,4,4,2,1,2,3,0,3,4,3,3,3,3,4,"Sometimes the instructions were a bit ambiguous, or could have multiple interpretations.","""go with the big blue pyramid, on the side of the big box""",5,5,6,5,7
11/05/2022 10:07:01,60,38,Female,Swedish,Masters degree,It does not apply.,2,No,3,,,,,,,1,1,3,1,1,3,3,2,1,2,2,2,0,1,1,2,0,0,1,1,2,"Yes, it and my left and right were an issue. Also, sometimes it felt like it was simply not working","""go with the big blue pyramid, on my right""",4,3,4,3,3
11/05/2022 11:36:22,61,23,Male,Italian,Bachelors degree,Aerospace Engineering,1,Yes,6,20,"When I thought I could not help more, meaning I was not achieving the task",3,The sake of being helpful,"Very impactful, especially in kids education/healthcare",,4,3,1,1,3,1,3,3,4,1,0,1,2,0,4,4,3,2,4,4,3,no,"""go with the big blue pyramid, on the side of the big box""",5,4,5,3,6
11/05/2022 12:41:44,62,19,Female,Australian,Some college but no degree,Computer Science,3,No,2,,,,,,,2,3,1,1,3,1,0,3,0,0,1,1,4,0,2,0,3,3,1,3,1,"Yes, it took me many tries before I realized the instructions were from the robot's perspective, I assumed right meant my right instead and the thought it could be otherwise did not occur to me.","""go with the big blue pyramid, on your left""",4,5,6,2,3
11/05/2022 13:28:26,63,19,Male,Swedish,Some college but no degree,Computer Science,3,Yes,5,13,When i got to another batch of the sentences that you read multiple times with different emotions that I found boring,2,I wanted to help advance the cause of sience,I think they can have great impact which is one of the reasons that i decided to join this study in the first place,,3,0,1,3,1,1,4,3,1,2,4,1,0,3,1,4,2,3,1,3,0,"Sometimes the robot would issue a description that fit with two different pyramids. For example, ``Show me the pyramid at the end of the line``","""go with the big blue pyramid, on the side of the big box""",5,2,3,4,6
12/05/2022 11:32:43,64,23,Male,Swedish,Bachelors degree,Electric Power Engineering,1,Yes,7,3,When I noticed I\m terrible at making up emotion with my voice.,2,Curiosity,"Quite impactful to help absolute loneliness but not replace human interaction, unless extremely similar to humans. ",,1,1,1,0,2,1,3,3,2,3,1,1,3,0,1,3,1,3,1,2,3,"Yes, once I didn't hear/listen carefully enough and another time I missed that it should be a ""square"" pyramid.","""go with the big blue pyramid, on your left""",7,3,5,2,2
11/05/2022 16:40:04,65,24,Female,Swedish,Bachelors degree,Architecture,8,No,6,,,,,,Fun! ,2,3,1,1,3,2,3,3,3,2,1,2,1,1,2,3,3,2,2,3,3,"yes, first it only said ""on the right"" which could be either mine or its right","""go with the big blue pyramid, on your left""",5,5,5,5,3
12/05/2022 18:16:14,66,34,Female,Persian,Doctoral Degree,Computer Science,1,Yes,5,20,Have sth to do next,7,Like to have Social Robots in our life,In helping for alone people,,3,3,3,0,1,1,3,4,3,3,0,2,4,0,4,4,4,4,4,3,4,"In the beginning yes, afterwards, it was fine","""go with the big blue pyramid, on the side of the big box""",7,6,6,4,4
12/05/2022 16:57:40,68,23,Male,Portuguese,Masters degree,Chemistry,0,No,4,,,,,,,2,3,0,1,3,1,4,3,3,1,1,0,1,0,2,4,4,2,1,2,3,Not much.,"""go with the big blue pyramid, on your left""",4,2,3,3,3
13/05/2022 09:12:33,70,26,Female,Persian,Masters degree,Computer Science,2,No,6,,,,,,No,4,4,2,0,2,2,3,4,4,1,4,1,3,0,4,4,4,4,4,4,4,it should be mentioned that suppose the right or left from the robot view not your view.,"""go with the big blue pyramid, on my right""",7,7,7,7,7
13/05/2022 11:55:51,69,21,Female,Swedish,Some college but no degree,Another field,0,Yes,6,8,I felt like i couldn't read the senteces in very different emotions so i felt like it might give the robot bad training,5,I have the time so I'm happy to help,"Very big, for example provide help in public places and provide information or at home like a next generation ""alexa""",,3,3,1,2,4,0,3,2,3,0,1,1,3,0,3,2,4,3,1,2,2,Yes when there were a lot of instructions but then i tried to slowly repeat it in my head,"""go with the big blue pyramid, on your left""",6,4,5,3,4
13/05/2022 14:17:59,67,32,Female,turkish,Doctoral Degree,Innovative Technology for Healthy Living,10,Yes,5,10,I have a meeting and I was bored,5,contributing research,First we need to find a problem to help then use the robots,"at the end I didnt understand I have to open the box again, it would be nice to say open the box again! may be. and instruictions should be read from somewhere for the consistency",2,2,1,0,3,1,3,3,3,1,0,0,3,0,3,3,3,2,1,2,2,"yes sometimes and I asked for clarification such as which one and found them on second time, the robot changed the perspective but since it used objects as reference it was easy to find the most of the objects","""go with the big blue pyramid, on the side of the big box""",6,5,4,3,4